code,content,topic,time
POW,Pow bị điên à mập gom hàng hay gì đây,,2022-05-04T11:00:56+0700
POW,"Không đẩy pow giữ nhịp thì nãy giờ tt gãy rồi anh
","
pow đẩy ác thế ?
",2022-05-04T10:57:18+0700
POW,pow đẩy ác thế ?,,2022-05-04T10:55:02+0700
POW,Pow gâu gâu đi ngược thị trường thế nhỉ,,2022-05-04T09:31:36+0700
REE,"
Rẻ thì mình thích thằng dnse. App đẹp vãi lol","
ETF mua bán như 1 mã CP bình thường ở các công ty chứng khoán chứ ko phải qua công ty quản lý quỹ, vì vậy mở tk ở thằng nào có phí rẻ nhất rồi mua thôi. Rẻ nhất hiện giờ chắc là AIS, pinetree
",2022-05-01T11:57:12+0700
REE,"ETF mua bán như 1 mã CP bình thường ở các công ty chứng khoán chứ ko phải qua công ty quản lý quỹ, vì vậy mở tk ở thằng nào có phí rẻ nhất rồi mua thôi. Rẻ nhất hiện giờ chắc là AIS, pinetree","
nếu đầu tư vào etf thì nên chọn thằng nào vậy thím và có app di động như thằng dragon capital ko nhỉ",2022-04-30T09:10:17+0700
REE,"
nếu đầu tư vào etf thì nên chọn thằng nào vậy thím và có app di động như thằng dragon capital ko nhỉ","
Quỹ mở thì free phí mua định kỳ, giữ 1-2 năm thì free phí bán. ETF thì mua bán gì cũng tính phí y như mã CP thường.",2022-04-30T09:02:03+0700
REE,"Quỹ mở thì free phí mua định kỳ, giữ 1-2 năm thì free phí bán. ETF thì mua bán gì cũng tính phí y như mã CP thường.","
thím có thể liệt kê giúp e điểm lợi với nhược của quỹ mở và etf đc ko? người mới chơi và đầu tư lâu dài thì nên chọn cái nào nhỉ. e có tìm hiểu mà toàn thấy etf lợi nhuận sẽ cao hơn quỹ mở, còn về nhược thì ko thấy nói mấy nên cảm giác etf vượt hẳn quỹ mở ấy",2022-04-30T08:53:13+0700
MBB,Dm con cổ phiếu đầu tiên mua. Ngày đầu lơ ngơ tôi mua phải con này. Công ty éo j toàn đầu tư cổ phiếu,"
MBB thôi",2022-04-29T14:48:55+0700
TPB,"giao dịch quỹ lớn cơ cấu tay trái sang phải thôi, ko có tin xấu mà nhảy vào bán coi chừng nhầm","
vl TPB giấu lệnh hay s sàn kia
",2022-04-29T14:39:48+0700
VPB,à à Vpb Tpb ctg muốn gãy,"
nay quỹ cơ cấu phiên ATC
",2022-04-29T14:34:22+0700
TPB,à à Vpb Tpb ctg muốn gãy,"
nay quỹ cơ cấu phiên ATC
",2022-04-29T14:34:22+0700
CTG,à à Vpb Tpb ctg muốn gãy,"
nay quỹ cơ cấu phiên ATC
",2022-04-29T14:34:22+0700
TPB,nay quỹ cơ cấu phiên ATC,"
vl TPB giấu lệnh hay s sàn kia
",2022-04-29T14:33:19+0700
TPB,vl TPB giấu lệnh hay s sàn kia,,2022-04-29T14:31:46+0700
MBB,MBB thôi,"
h muốn vào thử 1 con bank nào đó thì con nào ổn các bô lão nhỉ
",2022-04-29T14:17:47+0700
MBB,"A đòi bank tím lịm à? Bank nó tăng, nhưng ko phải dòng phi mã ","
có 1,2% .... tui ôm con MBB thôi .
",2022-04-29T13:51:29+0700
POW,Con cục sh1t ấy may chạy kịp ,"
2 năm trước mình đã nghĩ con POW như vậy và nó vẫn lình xình đến giờ
",2022-04-29T13:31:44+0700
POW,2 năm trước mình đã nghĩ con POW như vậy và nó vẫn lình xình đến giờ,"
Pow 16 lên sát 19 Ko chốt oánh gia tăng chờ nó vượt đỉnh ",2022-04-29T13:29:26+0700
CTG,Mẹ tao bắt dao hồi 32.7 mà còn đéo chịu được phải vác dé chạy đây. Chôn vốn mà xa bờ. Giờ đang nhiều con ngon cắt 1 ít mà chuyển sang gỡ lại còn ngon hơn.,"
T mua CTG lúc giá 36 đây, nói chung là hold to die chứ ngắn hạn chắc éo trông mong gì được.
",2022-04-29T12:53:05+0700
POW,sau đó phải trung bình giá xuống để về bờ đúng không ,"
Pow 16 lên sát 19 Ko chốt oánh gia tăng chờ nó vượt đỉnh ",2022-04-29T12:25:58+0700
POW,"
Chiều nay, có gì biến chuyển ko mai fen","
Pow 16 lên sát 19 Ko chốt oánh gia tăng chờ nó vượt đỉnh ",2022-04-29T12:02:52+0700
POW,Pow 16 lên sát 19 Ko chốt oánh gia tăng chờ nó vượt đỉnh ,"
Đuỵt cụ con CTG tôi vào 34 lên 38 đéo chốt còn vào thêm, nó sụt cho về, sml cuối cùng cần tiền nên phải cắt lỗ. Cay đcđ
",2022-04-29T12:00:07+0700
CTG,Pow 16 lên sát 19 Ko chốt oánh gia tăng chờ nó vượt đỉnh ,"
Đuỵt cụ con CTG tôi vào 34 lên 38 đéo chốt còn vào thêm, nó sụt cho về, sml cuối cùng cần tiền nên phải cắt lỗ. Cay đcđ
",2022-04-29T12:00:07+0700
CTG,"T mua CTG lúc giá 36 đây, nói chung là hold to die chứ ngắn hạn chắc éo trông mong gì được.","
Mẹ con CTG= chừa tới già đấy, 2 lần bắt dao cụt cả 2 thôi xin vái con bank ghẻ. Lình xình vãi lồn ngang con phò LPB của thằng Thụy Nổ
",2022-04-29T11:52:13+0700
CTG,"
Đuỵt cụ con CTG tôi vào 34 lên 38 đéo chốt còn vào thêm, nó sụt cho về, sml cuối cùng cần tiền nên phải cắt lỗ. Cay đcđ","
Mẹ con CTG= chừa tới già đấy, 2 lần bắt dao cụt cả 2 thôi xin vái con bank ghẻ. Lình xình vãi lồn ngang con phò LPB của thằng Thụy Nổ
",2022-04-29T11:46:25+0700
VCB,Nay VCB đang họp đại hội cổ đông bên Ecopark từ 8h. Anh em có định xúc VCB hem. hê hê.,,2022-04-29T08:54:01+0700
VPB,"Thôi lỡ VPB giá ngon thì vào ít MBB giá đỏ, hihi ",,2022-04-28T14:23:40+0700
VPB,Mua hụt VPB gió đỏ đang cay thím ,"
bán được TCB xanh tí gáy quá ",2022-04-28T14:06:07+0700
VPB,"hàng anh còi có vào thì vào mấy hôm trc, chứ giờ vào dễ ăn bô ","
Vừa bán được ít TCB giá thơm, và đợi VPB giá ngon để vào hàng hihi",2022-04-28T09:24:30+0700
VPB,"Vừa bán được ít TCB giá thơm, và đợi VPB giá ngon để vào hàng hihi",,2022-04-28T09:23:43+0700
VHM,"Trend chưa rõ e cũng chưa dám xuống tiền, hôm suýt bắt đáy con VHM với MBB rồi nhưng hôm đó TTđi hơn 70 điểm, run tay lại hủy lệnh. Hôm đó mà ko hủy giờ cũng ấm rồi ",,2022-04-28T08:59:43+0700
TCH,"Xa xỉ quá, tôi chỉ đang muốn đổi con Gamin đang xài thôi ","
Lời cũng là tiền mà, mất rồi sẽ lại được nhưng mà do thói quen ko chốt lời mà để mất con Rolex Yatch Master mơ ước rồi.
",2022-04-27T16:36:56+0700
VRE,VRE nha bro,"
Đang có vốn nhàn rỗi tầm 1 tỷ ++ tầm 2 tuần có mã nào lướt nhanh kiếm ít tã sữa cho con bú ko mấy pro ?
",2022-04-27T16:36:55+0700
VNM,nếu ông chơi ngắn hạn thì tôi thấy còn đầy con ngon hơn,"
Giờ có nên vào VNM khônh các fen
",2022-04-27T13:59:25+0700
VNM,bắt đáy à ,"
Giờ có nên vào VNM khônh các fen
",2022-04-27T13:54:55+0700
VNM,Giờ có nên vào VNM khônh các fen,,2022-04-27T13:52:23+0700
CTR,"T cũng bán trước 1 ngày nhưng mà méo khớp, mà thôi dù sao cũng chốt đc lãi, còn hơn là lỗ, mà giờ nhiều con giá ngon hơn CTR rồi, tính ra CTR PE cũng cao hơn thị trường khá là nhiều","
T Bán trước 1 ngày thì né dc 1 cây sàn. Hôm qua fen bán cũng trễ thật. Mà sáng giờ cũng chỉ loanh quanh tham chiếu nên đừng vội buồn. Mua 8x thì cũng có cà phê cà pháo rồi. ",2022-04-27T09:56:53+0700
CTR,con tar đu đỉnh 40 chắc phải xanh 10 phiên mới hết lỗ ,"
Lần đầu tiên sau nhiều ngày, danh mục có 2 con tar và ctr xanh có lãi do mua mới ",2022-04-27T09:32:46+0700
CTR,"Lần đầu tiên sau nhiều ngày, danh mục có 2 con tar và ctr xanh có lãi do mua mới ",,2022-04-27T09:30:10+0700
GAS,Cần Thơ có Tô Châu được phết đó thím ,"
lasvegas mảnh ",2022-04-27T07:11:36+0700
GAS,lasvegas mảnh ,"
Say quá ",2022-04-27T00:46:49+0700
CTG,"Đảo lạc được cứ đảo thôi, để ngta ăn từ đáy thì bao giờ mới lời","
Ctg bị định giá thấp qá. Chứ nó rất ok ",2022-04-26T16:01:01+0700
CTG,Có chỉ thị gì mới chưa cu ,"
Ctg bị định giá thấp qá. Chứ nó rất ok ",2022-04-26T15:39:17+0700
CTG,Ctg bị định giá thấp qá. Chứ nó rất ok ,"
Đảo ctg, vnd ăn 10% ngon lành
",2022-04-26T15:38:22+0700
VHM,Quote lại phát ,"
buổi tối có thời gian ngồi xem lại thì thấy hầu hết là RSI < 20, và đã tạo phân kỳ âm trên chart H1 rất rõ rệt. biết là tầm này PTKT là đbrr nhưng cũng cho thấy khả năng hồi cao, khả năng thua nặng thấp hơn ăn to. Một số con như HHV, VOS test lại đáy 2 chưa thủng. MSB có đỡ giá ở 22, đợt trc chủ tịch Tuấn mua vào 23, nên khả năng mốc 22-23 này chơi được. VHM thoát sàn còn giảm có 2%, khả năng 60 là chặn cứng, đầu tư ở đây an toàn.
",2022-04-26T14:36:39+0700
VPB,"Trả điểm VPB hôm qua nào
",,2022-04-26T14:27:14+0700
VIC,Có gì run nãy chơi bẩn vic đang xanh đạp về âm 3% để kéo điểm ,"
sắp 2h rồi. Run quá mấy bác ơi
",2022-04-26T13:52:41+0700
VPB,"Có hàng bán giá tím luôn, cover lại giá xanh, lãi easy","
Vãi nồi, VPB tím được kìa",2022-04-26T13:21:41+0700
VPB,VPB dẫn sóng nh rồi.,,2022-04-26T13:20:01+0700
VPB,"Vãi nồi, VPB tím được kìa ",,2022-04-26T13:19:28+0700
CTR,Sao bằng CTD ,"
CTR tụt kinh thế nhỉ? Xả lũ sau đợt tăng nhưng cũng sàn 2 phiên rồi.
",2022-04-26T13:00:26+0700
CTR,CTR tụt kinh thế nhỉ? Xả lũ sau đợt tăng nhưng cũng sàn 2 phiên rồi.,,2022-04-26T12:08:45+0700
VHM,Đầu 6 mấy nay rồi ,"
Mắt mũi kém quá nên nhầm, VHM mới đúng ",2022-04-26T11:16:31+0700
VHM,"Mắt mũi kém quá nên nhầm, VHM mới đúng ","
60 đâu ra fen ",2022-04-26T11:14:45+0700
VNM,60 đâu ra fen ,"
Mấy hôm nay không để ý giờ thấy VNM xuống 60k rồi ",2022-04-26T11:12:13+0700
VNM, ai ôm 82 lại nằm 2 năm nữa ,"
Mấy hôm nay không để ý giờ thấy VNM xuống 60k rồi ",2022-04-26T11:09:39+0700
VNM,Mấy hôm nay không để ý giờ thấy VNM xuống 60k rồi ,,2022-04-26T11:08:44+0700
BID,Bank có BID kéo lực chứ mấy nhỉ,,2022-04-26T10:27:27+0700
VHM,"Tăng bằng lần đâu phải con nào cũng làm được, may mắn thì ngon thôi. Chơi coin có cái là đẩy điểm chốt lời","
Bác nói lại hay quá. Thế như FRT nó tăng bằng lần trong 2 năm. DIG CEO lái lên vũ trụ thế kia thì các doanh nghiệp có nội tại tốt như VHM tại sao lại ko hold?",2022-04-26T09:49:22+0700
VHM,thảm vậy thím,"
Bác nói lại hay quá. Thế như FRT nó tăng bằng lần trong 2 năm. DIG CEO lái lên vũ trụ thế kia thì các doanh nghiệp có nội tại tốt như VHM tại sao lại ko hold?",2022-04-26T09:36:21+0700
VHM,Bác nói lại hay quá. Thế như FRT nó tăng bằng lần trong 2 năm. DIG CEO lái lên vũ trụ thế kia thì các doanh nghiệp có nội tại tốt như VHM tại sao lại ko hold?,"
Chơi lâu dài mà lời không chốt, lỗ không xử lí thì trách ai ",2022-04-26T09:35:26+0700
FPT,"FPT SSI SAB sàn
",,2022-04-26T09:02:02+0700
VHM,Cổ tức thì nó cũng phản ánh trong giá rồi trừ khi dùng cổ tức tái đầu tư. Thế bác có cầm không? ,"
Ông có cầm vhm từ tháng 5/2018 đến h Ko mà kêu lỗ ",2022-04-26T07:59:34+0700
VHM,Ông có cầm vhm từ tháng 5/2018 đến h Ko mà kêu lỗ ,"
Bác nói mang tính ",2022-04-26T07:55:13+0700
VPB,Lô ở hồ đồng đò à ,"
nó quá khôn. Sau Khi trả lời báo chí vừa rồi của 1 số Chủ tịt về giá cổ bank sao thấp thế. Tiêu biểu là abb, trend bank k có nó chả té gom tiền về đi nhặt dép ngon dép đẹp văng ra. T cũng mải nhặt dép nên mới k đủ tiền nhập bank (Ban đầu cũng thik vpb cơ ",2022-04-25T22:50:49+0700
VPB,"nó quá khôn. Sau Khi trả lời báo chí vừa rồi của 1 số Chủ tịt về giá cổ bank sao thấp thế. Tiêu biểu là abb, trend bank k có nó chả té gom tiền về đi nhặt dép ngon dép đẹp văng ra. T cũng mải nhặt dép nên mới k đủ tiền nhập bank (Ban đầu cũng thik vpb cơ ","
Ocb nay sao Tây đầu đen nó xả nhiều thế nhỉ ",2022-04-25T22:44:25+0700
VHM,"buổi tối có thời gian ngồi xem lại thì thấy hầu hết là RSI < 20, và đã tạo phân kỳ âm trên chart H1 rất rõ rệt. biết là tầm này PTKT là đbrr nhưng cũng cho thấy khả năng hồi cao, khả năng thua nặng thấp hơn ăn to. Một số con như HHV, VOS test lại đáy 2 chưa thủng. MSB có đỡ giá ở 22, đợt trc chủ tịch Tuấn mua vào 23, nên khả năng mốc 22-23 này chơi được. VHM thoát sàn còn giảm có 2%, khả năng 60 là chặn cứng, đầu tư ở đây an toàn.",,2022-04-25T22:37:23+0700
VHM,"ý mình là thứ 6 chart có chút tích cực, cộng với tin tức cuối tuần, ai ngờ.......","
Lừa gì sáng nay vẫn ngon mà mình cầm chỉ đạo 3 hhv dah flc chiếm 70% nav còn lại là dri ita vic vhm geg thì phiên sáng nay và đầu chiều Ko quá tồi ",2022-04-25T16:39:57+0700
VIC,"ý mình là thứ 6 chart có chút tích cực, cộng với tin tức cuối tuần, ai ngờ.......","
Lừa gì sáng nay vẫn ngon mà mình cầm chỉ đạo 3 hhv dah flc chiếm 70% nav còn lại là dri ita vic vhm geg thì phiên sáng nay và đầu chiều Ko quá tồi ",2022-04-25T16:39:57+0700
VHM,"Sáng nay còn ổn, giảm 30 điểm mà ITA, BCC, TAR, LIG, HAI vẫn xanh mạnh. Nhưng qua tầm 40 điểm là èo uột và qua 50 điểm thì tụt sml hết.","
Lừa gì sáng nay vẫn ngon mà mình cầm chỉ đạo 3 hhv dah flc chiếm 70% nav còn lại là dri ita vic vhm geg thì phiên sáng nay và đầu chiều Ko quá tồi ",2022-04-25T16:38:36+0700
VIC,"Sáng nay còn ổn, giảm 30 điểm mà ITA, BCC, TAR, LIG, HAI vẫn xanh mạnh. Nhưng qua tầm 40 điểm là èo uột và qua 50 điểm thì tụt sml hết.","
Lừa gì sáng nay vẫn ngon mà mình cầm chỉ đạo 3 hhv dah flc chiếm 70% nav còn lại là dri ita vic vhm geg thì phiên sáng nay và đầu chiều Ko quá tồi ",2022-04-25T16:38:36+0700
VHM,Lừa gì sáng nay vẫn ngon mà mình cầm chỉ đạo 3 hhv dah flc chiếm 70% nav còn lại là dri ita vic vhm geg thì phiên sáng nay và đầu chiều Ko quá tồi ,"
hoá ra thứ 6 vừa rồi là cú lừa à thím ",2022-04-25T16:35:10+0700
VIC,Lừa gì sáng nay vẫn ngon mà mình cầm chỉ đạo 3 hhv dah flc chiếm 70% nav còn lại là dri ita vic vhm geg thì phiên sáng nay và đầu chiều Ko quá tồi ,"
hoá ra thứ 6 vừa rồi là cú lừa à thím ",2022-04-25T16:35:10+0700
VHM,VHM chia ra gom 1 ít vùng này đc rồi nè,,2022-04-25T16:09:53+0700
VPB,"
DPM lãi 2K tỷ gấp 10 lần quý 1 năm ngoái, nó còn sàn 2 phiên liên tiếp kìa ","
Hảo vpb lãi 11k tỉ quý 1 nay sàn luôn,sáng còn mới múc thêm margin nữa
",2022-04-25T13:32:48+0700
VPB,"Hảo vpb lãi 11k tỉ quý 1 nay sàn luôn,sáng còn mới múc thêm margin nữa
",,2022-04-25T13:30:18+0700
MWG,"bao nhiêu lãi con mwg gánh danh mục giờ âm sạch, âm nặng",,2022-04-25T11:58:27+0700
VRE,VN30 đỏ sạch sẽ trừ VRE @@,,2022-04-25T11:16:32+0700
PLX,1 năm sau tất nhiên là bán dc. Nhưng lỗ hay lãi thì ko ai biết ,"
E mới vào 3k cp PLX để đó 6 tháng tới 1 năm sau bán đc k các thím. Tại thấy giá đang đẹp quá
",2022-04-25T10:24:47+0700
PLX,khuyên chờ qua tháng vào ... cả đống mã đáy.,"
E mới vào 3k cp PLX để đó 6 tháng tới 1 năm sau bán đc k các thím. Tại thấy giá đang đẹp quá
",2022-04-25T10:24:34+0700
PLX,E mới vào 3k cp PLX để đó 6 tháng tới 1 năm sau bán đc k các thím. Tại thấy giá đang đẹp quá,,2022-04-25T10:19:53+0700
MWG,"GAS , SAB, MSN, FPT MWG
","
Đạp cái gì mà đỏ thế Ae nhỉ",2022-04-25T09:52:42+0700
GAS,"GAS , SAB, MSN, FPT MWG
","
Đạp cái gì mà đỏ thế Ae nhỉ",2022-04-25T09:52:42+0700
FPT,"GAS , SAB, MSN, FPT MWG
","
Đạp cái gì mà đỏ thế Ae nhỉ",2022-04-25T09:52:42+0700
CTR,"CTR sàn cmnl rồi kìa, chắc tay to chốt hàng rồi",,2022-04-25T09:51:12+0700
VCB,"Đang xem xét con VCB các fence ạ <("") đợt trước chạy được tí vốn.",,2022-04-25T09:40:39+0700
VHM,không thấy lối ra. đâu có dự án nào mới đâu ta? mới nghe là dc giao đất ở thanh hóa thôi. Mà BDS ko khởi công chỉ có đất thì ăn cám ,"
em nghĩ vhm dca không vào lúc này thì còn đợi được đến lúc nào ",2022-04-24T19:13:13+0700
VHM,"nó giảm mới có cái giá đó cho mua chớ, ko giảm thì làm gì có cái giá đó được.","
Thứ 2 doanh số VHM đang trong giai đoạn sụt giảm. Kể cả nó bán hàng vẫn tốt thì cũng chả nên đầu tư vào cty đang đi xuống.
",2022-04-24T18:56:46+0700
VIC,"Mấy con bên VHM,VIC nếu không hold quá lâu e thấy vẫn vào được, biên độ giá ko cao lắm nhưng cũng ko đến mức đánh bạc như mấy con khác. Hiện giờ mấy con BĐS đều đang chênh vênh, lên xuống theo xu hướng thị trường, vào nó rồi ngoài dựa vào lực làm ăn của cty thì lúc thị trường lên có lãi đạt target thì chốt là được. Quan trọng là mức giá chốt target đừng cao quá thì ổn","
Thứ nhất hàng của vin là hàng điều tiết thị trường. Lên xuống là do ý chí bên trên. Chơi hàng này như chơi với nhà cái, nó cho thắng hay thua cũng phải ngậm mồm.",2022-04-24T18:35:08+0700
VHM,Xin tài liệu ,"
Cái đấy là chính mồm thằng VHM nói trong tài liệu ĐHCĐ chứ tôi chém gió ra đâu.
",2022-04-24T18:29:12+0700
VHM,Cái đấy là chính mồm thằng VHM nói trong tài liệu ĐHCĐ chứ tôi chém gió ra đâu.,"
Vế đầu ổn ",2022-04-24T18:28:37+0700
VHM,"Thứ nhất hàng của vin là hàng điều tiết thị trường. Lên xuống là do ý chí bên trên. Chơi hàng này như chơi với nhà cái, nó cho thắng hay thua cũng phải ngậm mồm.","
em nghĩ vhm dca không vào lúc này thì còn đợi được đến lúc nào ",2022-04-24T18:12:05+0700
VHM,"EM cũng rình vào lâu rồi, phiên 2 tuần trước có đặt lệnh nhưng giá ko xuống đến tầm, sau giải tỏa, em chưa mua lại nữa","
có bác nào ở đây đang soi con vhm không?
",2022-04-24T16:54:33+0700
VHM,em nghĩ vhm dca không vào lúc này thì còn đợi được đến lúc nào ,,2022-04-24T16:40:42+0700
VHM,có bác nào ở đây đang soi con vhm không?,,2022-04-24T16:40:08+0700
VHM,"Tính ra biết đầu tư ck thì cũng dân ăn học đàng hoàng vậy mà các thánh trên fireant chửi như hát, có đứa chửi kỳ lắm... không hiểu nổi ","
Em thì hay lên đây và FireAnt. Mục đích chính là hóng anh em kêu khóc với chửi nhau. Ví dụ đợt rồi VHM VIC bị đạp liên tục trên FireAnt nó chửi Vượng như tế đọc hài ",2022-04-24T11:07:34+0700
VIC,"Tính ra biết đầu tư ck thì cũng dân ăn học đàng hoàng vậy mà các thánh trên fireant chửi như hát, có đứa chửi kỳ lắm... không hiểu nổi ","
Em thì hay lên đây và FireAnt. Mục đích chính là hóng anh em kêu khóc với chửi nhau. Ví dụ đợt rồi VHM VIC bị đạp liên tục trên FireAnt nó chửi Vượng như tế đọc hài ",2022-04-24T11:07:34+0700
VHM,Em thì hay lên đây và FireAnt. Mục đích chính là hóng anh em kêu khóc với chửi nhau. Ví dụ đợt rồi VHM VIC bị đạp liên tục trên FireAnt nó chửi Vượng như tế đọc hài ,"
Thực ra người khác hú 1 mã giống như cho mình 1 gợi ý, vào hay ko, vào bn là do mình.",2022-04-24T10:08:29+0700
VIC,Em thì hay lên đây và FireAnt. Mục đích chính là hóng anh em kêu khóc với chửi nhau. Ví dụ đợt rồi VHM VIC bị đạp liên tục trên FireAnt nó chửi Vượng như tế đọc hài ,"
Thực ra người khác hú 1 mã giống như cho mình 1 gợi ý, vào hay ko, vào bn là do mình.",2022-04-24T10:08:29+0700
CTR,"
Hôm qua đhcđ nè fen.","
thoát CTR ko anh, hay thôi hold tới 2025 với tôi nhỉ ",2022-04-23T14:44:30+0700
VPB,"
HBC và chữ V là VPB","
Hnay lái quốc doanh mới kéo trụ để giữ mặt cho thủ thôi ",2022-04-23T06:04:17+0700
POW,Yên tâm tiền thịt cổ tốt thì mặc sức mà ăn ,"
tháng trc vào asm với ô xabi, frt với ô quét trần và con pow cho có tý vn30, vẫn giữ ko bán cho đến thời điểm này (vẫn có lãi), còn lại lướt con nào chết con đấy, đu con nào toang con đấy, tạm rút ra là năm nay lướt sóng sẽ rất mất rất nhiều tiền cũng như niềm tin
",2022-04-22T21:07:58+0700
POW,"tháng trc vào asm với ô xabi, frt với ô quét trần và con pow cho có tý vn30, vẫn giữ ko bán cho đến thời điểm này (vẫn có lãi), còn lại lướt con nào chết con đấy, đu con nào toang con đấy, tạm rút ra là năm nay lướt sóng sẽ rất mất rất nhiều tiền cũng như niềm tin",,2022-04-22T21:06:17+0700
VIC,Mình dự đoán là VIC,"
Chữ V có 1 chữ V ",2022-04-22T17:57:14+0700
VCB,VCB chăng? Hay VCD? ,,2022-04-22T17:28:57+0700
GAS,"vl đẩy gas ce tăng chỉ số, chiêu này thì bó tay rồi",,2022-04-22T14:44:41+0700
CTR,"thoát CTR ko anh, hay thôi hold tới 2025 với tôi nhỉ ","
Kéo CTR rồi à. Kiểu đéo gì mà 500K cổ sàn đi nhanh thế
",2022-04-22T14:24:18+0700
CTR,Kéo CTR rồi à. Kiểu đéo gì mà 500K cổ sàn đi nhanh thế,,2022-04-22T14:22:39+0700
CTR,"Tưởng đâu em nó cứng, hóa ra cũng sàn cơ à, mua từ giá 8x ko lo lắm ","
CTR hôm nay sàn luôn mới kinh dị ",2022-04-22T13:22:31+0700
CTR,CTR hôm nay sàn luôn mới kinh dị ,,2022-04-22T13:10:53+0700
STB,Ông nào cutlost hết STB tại đỉnh kỳ này tức sòng sọc.,"
Cổ đông Sacombank đi dự đhcđ dược tặng 0.5 chỉ vàng chậc
",2022-04-22T12:28:09+0700
KDH,Ko phải nha fen.,"
KDH hả bác?
",2022-04-22T09:15:20+0700
KDH,KDH hả bác?,"
Tôi đầu tư vào cty fen ạ. Mã thì tôi không muốn bàn luận trên này (sở thích cá nhân thôi), nhưng nó là hàng BĐS (ko phải hàng A7). Cty này tôi đã nghiên cứu trong 1 tg rất dài, đến cả thực địa. Tôi biết chắc chắn là nó vẫn làm ăn ngon lành, nên kĩ thuật có xấu mấy cũng chả là vấn đề. Kể cả VNI về 1000 tôi cũng chả quan tâm lắm.
",2022-04-22T09:12:20+0700
VHM,"Mình cũng ko theo dõi mấy con bds nhưng theo như hiện tại thì là thời kì thoái trào của bds dân cư thôi mà, cuối cùng vẫn là câu chuyện nắn dòng tiền vào sxtd ","
VHM nó bị gì mà giảm không thấy đáy vậy các thím ",2022-04-21T15:51:30+0700
VHM,VHM nó bị gì mà giảm không thấy đáy vậy các thím ,,2022-04-21T15:46:29+0700
VHM,VHM nó bị sao vậy các thím ,,2022-04-21T15:38:42+0700
VCB,"Ai giải thích được mình xin gọi là thánh, tầm này chỉ lái hotel họ biết thôi ","
Mai fen giải thích hộ tôi con hàng VCB sao thế",2022-04-21T15:08:44+0700
VCB,nó là hàng của tạo lập thị trường. Vốn hóa siêu to khổng lồ. Chỉ cần kéo nó lên thì sẽ tăng điểm cho thị trường.,"
Mai fen giải thích hộ tôi con hàng VCB sao thế",2022-04-21T15:06:03+0700
VCB,"
Mai fen giải thích hộ tôi con hàng VCB sao thế","
Nói rồi anh em éo nghe, cứ vui sớm làm gì",2022-04-21T15:04:13+0700
VCB,Vl vcb từ trần về tham chiếu trong nốt nhạc,,2022-04-21T14:51:13+0700
VCB,"Vãi mấy anh lái quốc doanh kéo STB, VCB",,2022-04-21T14:38:45+0700
VCB,Vcb vừa trần ,,2022-04-21T14:33:06+0700
TPB,bắt dc ít SSI 35 với TPB 34.7 hi vọng có ăn ,,2022-04-21T11:56:07+0700
POW,"AAA nó lên chậm lắm fen, trước mua xong thấy cả tháng chỉ dao động 0.x ngứa mắt quá sút luôn, lãi đc tý tình cảm","
Bắt dao AAA, POW bị cụt mấy 3 ngón rồi. Có thím nào chung thuyền 2 con này không nhỉ. Hold to die.
",2022-04-21T11:15:42+0700
REE,"
thanh khoản 1 ngày có 8tr cổ mà anh ôm những mấy triệu, chắc a người nhà lãnh đạo tập đoàn rồi","
Hold 1 đống rồi đó chứ, vs giá vốn t vẫn thấp hơn giá hiện tại. Vẫn phải để cash làm risk management chứ có cái gì risk free 100% đâu.",2022-04-21T11:11:03+0700
REE,Tôi thấu hiểu nổi buồn của anh mà ,"
Hold 1 đống rồi đó chứ, vs giá vốn t vẫn thấp hơn giá hiện tại. Vẫn phải để cash làm risk management chứ có cái gì risk free 100% đâu.",2022-04-21T11:07:58+0700
POW,aaa giá 19 và cầm 30% tk đây,"
Bắt dao AAA, POW bị cụt mấy 3 ngón rồi. Có thím nào chung thuyền 2 con này không nhỉ. Hold to die.
",2022-04-21T11:05:32+0700
REE,"Hold 1 đống rồi đó chứ, vs giá vốn t vẫn thấp hơn giá hiện tại. Vẫn phải để cash làm risk management chứ có cái gì risk free 100% đâu.","
Vậy thì anh phải mua thêm ấy nhỉ
",2022-04-21T11:05:21+0700
FPT,"tôi nhớ hổi tháng 1 ,tháng 7 2021, khi máy thằng trụ vic, vnm, fpt mà chưa sàn thì chưa thấy đáy",,2022-04-21T11:04:45+0700
